{"$schema":"http://json-schema.org/draft-07/schema#","title":"Scope Claim Audit","type":"object","additionalProperties":false,"required":["schema_version","target_repository","pr_number","reviewed_head_sha","claim_sources","deterministic_diff_facts","sensitive_surfaces","claim_classification","scope_claim_result","signal_confidence","why_it_matters","recommended_action","enforcement_mode","wired_enforcement_gate","blocking","limitations"],"properties":{"schema_version":{"type":"string","const":"0.1"},"target_repository":{"type":"string","minLength":1},"pr_number":{"type":"integer","minimum":1},"reviewed_head_sha":{"type":"string","pattern":"^[0-9a-f]{40}$"},"claim_sources":{"type":"array","minItems":1,"items":{"type":"object","additionalProperties":false,"required":["source_type","author_type","excerpt","confidence"],"properties":{"source_type":{"type":"string","enum":["pr_title","pr_body","handoff","implementation_summary","commit_message","review_comment","unknown"]},"author_type":{"type":"string","enum":["human_authored","model_generated","mixed","unknown"]},"excerpt":{"type":"string"},"confidence":{"type":"string","enum":["low","medium","high"]}}}},"deterministic_diff_facts":{"type":"object","additionalProperties":false,"required":["files_changed","additions","deletions","changed_file_paths","changed_file_statuses","source_method","source_limitations"],"properties":{"files_changed":{"type":"integer","minimum":0},"additions":{"type":"integer","minimum":0},"deletions":{"type":"integer","minimum":0},"changed_file_paths":{"type":"array","items":{"type":"string"}},"changed_file_statuses":{"type":"array","items":{"type":"object","additionalProperties":false,"required":["path","status"],"properties":{"path":{"type":"string"},"status":{"type":"string","enum":["added","modified","removed","renamed","copied","changed","unchanged","unknown"]}}}},"source_method":{"type":"string","enum":["github_pr_files","github_compare","connector_diff","local_json","manual_evidence","unknown"]},"source_limitations":{"type":"array","items":{"type":"string"}}}},"sensitive_surfaces":{"type":"object","additionalProperties":false,"required":["protocol","schema","validator","workflow","release_lock","package_metadata","tests_fixtures","generated_output","docs","scripts","other"],"properties":{"protocol":{"type":"array","items":{"type":"string"}},"schema":{"type":"array","items":{"type":"string"}},"validator":{"type":"array","items":{"type":"string"}},"workflow":{"type":"array","items":{"type":"string"}},"release_lock":{"type":"array","items":{"type":"string"}},"package_metadata":{"type":"array","items":{"type":"string"}},"tests_fixtures":{"type":"array","items":{"type":"string"}},"generated_output":{"type":"array","items":{"type":"string"}},"docs":{"type":"array","items":{"type":"string"}},"scripts":{"type":"array","items":{"type":"string"}},"other":{"type":"array","items":{"type":"string"}}}},"claim_classification":{"type":"object","additionalProperties":false,"required":["inferred_claim_type","classification_confidence","classification_rationale","uncertainty_reason"],"properties":{"inferred_claim_type":{"type":"string","enum":["docs_only","small_fix","typo","refactor","feature","dependency_update","workflow_change","schema_contract_change","broad_change_declared","ambiguous","unknown"]},"classification_confidence":{"type":"string","enum":["low","medium","high"]},"classification_rationale":{"type":"string"},"uncertainty_reason":{"type":"string"}}},"scope_claim_result":{"type":"string","enum":["congruent","scope_expanded_but_declared","scope_underreported","mismatch","not_assessable"]},"signal_confidence":{"type":"string","enum":["low","medium","high"]},"why_it_matters":{"type":"string"},"recommended_action":{"type":"string"},"enforcement_mode":{"type":"string","enum":["advisory","enforced"],"default":"advisory"},"wired_enforcement_gate":{"type":["object","null"],"additionalProperties":false,"required":["target_repository","gate_name","workflow_path","check_name","enforcement_evidence","policy_reference"],"properties":{"target_repository":{"type":"string","minLength":1},"gate_name":{"type":"string","minLength":1},"workflow_path":{"type":"string","minLength":1},"check_name":{"type":"string","minLength":1},"enforcement_evidence":{"type":"string","minLength":1},"policy_reference":{"type":"string","minLength":1}}},"blocking":{"type":"boolean","default":false},"limitations":{"type":"array","items":{"type":"string"}}},"allOf":[{"if":{"properties":{"enforcement_mode":{"const":"advisory"}},"required":["enforcement_mode"]},"then":{"properties":{"blocking":{"const":false},"wired_enforcement_gate":{"type":"null"}}}},{"if":{"properties":{"blocking":{"const":true}},"required":["blocking"]},"then":{"properties":{"enforcement_mode":{"const":"enforced"},"wired_enforcement_gate":{"type":"object"}}}},{"if":{"properties":{"enforcement_mode":{"const":"enforced"}},"required":["enforcement_mode"]},"then":{"properties":{"wired_enforcement_gate":{"type":"object"}}}}]}
