{"schema_version":"0.1","target_repository":"rezahh107/example-contract-repo","pr_number":42,"reviewed_head_sha":"1234567890abcdef1234567890abcdef12345678","claim_sources":[{"source_type":"pr_title","author_type":"human_authored","excerpt":"cleanup","confidence":"high"}],"deterministic_diff_facts":{"files_changed":2,"additions":18,"deletions":6,"changed_file_paths":["docs/notes.md","tools/format_report.py"],"changed_file_statuses":[{"path":"docs/notes.md","status":"modified"},{"path":"tools/format_report.py","status":"modified"}],"source_method":"local_json","source_limitations":[]},"sensitive_surfaces":{"protocol":[],"schema":[],"validator":[],"workflow":[],"release_lock":[],"package_metadata":[],"tests_fixtures":[],"generated_output":[],"docs":["docs/notes.md"],"scripts":["tools/format_report.py"],"other":[]},"claim_classification":{"inferred_claim_type":"ambiguous","classification_confidence":"low","classification_rationale":"The claim is vague and the diff has docs plus a script, but the signal is not strong.","uncertainty_reason":"The word cleanup is too broad to prove under-reporting without stronger claim evidence."},"scope_claim_result":"not_assessable","signal_confidence":"low","why_it_matters":"The owner needs claim and changed surfaces to align.","recommended_action":"Ask for a clearer description if review context is insufficient.","enforcement_mode":"advisory","wired_enforcement_gate":null,"blocking":false,"limitations":["No PR body, commit messages, or review comments were available in this example."]}
