{"schema_version":"0.1","target_repository":"rezahh107/example-contract-repo","pr_number":42,"reviewed_head_sha":"1234567890abcdef1234567890abcdef12345678","claim_sources":[{"source_type":"pr_title","author_type":"human_authored","excerpt":"docs-only cleanup","confidence":"high"}],"deterministic_diff_facts":{"files_changed":4,"additions":87,"deletions":21,"changed_file_paths":["README.md","schemas/ci_gate_map.schema.json","tools/validate_gate_map.py",".github/workflows/validate.yml"],"changed_file_statuses":[{"path":"README.md","status":"modified"},{"path":"schemas/ci_gate_map.schema.json","status":"modified"},{"path":"tools/validate_gate_map.py","status":"modified"},{"path":".github/workflows/validate.yml","status":"modified"}],"source_method":"local_json","source_limitations":[]},"sensitive_surfaces":{"protocol":[],"schema":["schemas/ci_gate_map.schema.json"],"validator":["tools/validate_gate_map.py"],"workflow":[".github/workflows/validate.yml"],"release_lock":[],"package_metadata":[],"tests_fixtures":[],"generated_output":[],"docs":["README.md"],"scripts":[],"other":[]},"claim_classification":{"inferred_claim_type":"docs_only","classification_confidence":"high","classification_rationale":"The title says docs-only, but deterministic paths include schema, validator, and workflow surfaces.","uncertainty_reason":""},"scope_claim_result":"scope_underreported","signal_confidence":"high","why_it_matters":"The owner needs the claim to match sensitive changed surfaces before deciding review attention.","recommended_action":"Advisory: update the PR description to declare schema, validator, and workflow scope before review.","enforcement_mode":"advisory","wired_enforcement_gate":null,"blocking":false,"limitations":[]}
